,Unnamed: 0,sentiment,review,emopattern,emoscore,pnp,npn,pnpn,npnp,ppp,nnn,Total_pnp_patterns
251305,251305,-1,"This, like Tuesday with Morrie, is a lame book. The author is not a good writer, so he instead appeals to the most basic, non-intellectual emotions of his less than cerebral diehard fans by employing hackneyed, formulaic story lines. Really, his books are horrible. I read both of his bestsellers because they got such good reviews, but both times, I was severly disappointed. Reading an Albom book is like watching an After School Special or reading a Chicken Soup for the Soul book--he attempts to affect your emotions by using the most direct (non-creative), simple (non-intellectual) story lines, rather than being a truly creative author by making you react emotionally without having to shove the simpleton feel-good drivel down your throat. The onely good thing I can say about Albom's books--they're very short.",snnnnnp,0.9226349592208862,0,0,0,0,0,1,0
3111537,3111537,-1,I bought one of these for each of my children. They were so excited to get them. None worked. They also weren't too sturdy. They were disappointed in the first few minutes. Don't buy.,supnnnu,0.0,0,0,0,0,0,1,0
2883375,2883375,-1,"My daughter recieved this item for christmas as a gift...i wish i kept the box so i could return it! My daughter has totaly lost interest in it. It contains so many small stickers that is a major pain to put on, and none of the pieces stay together.Not very well made! And not worth 40 something dollars. I cant wait to toss the thing in the garbage!",spnnnn,-0.8188340067863464,0,0,0,0,0,1,0
1727150,1727150,-1,"This camera definitely has some major problems with its film loading system. Like the other reviewers, I couldn't load the film in even after too many tries. A very disappointing product.",snnn,-0.9251205325126648,0,0,0,0,0,1,0
3031999,3031999,-1,I was very disappointed with this item. I was expecting some overly rugged work flannel but what I received was a very low quality product. I doubt the shirt is made from 9 ounce cotton as advertised. It doesn't feel the least bit rugged nor is the durability to be taken seriously....more like flannels you see in walmart for a lot less.Made in china.,snnnn,-0.8070757389068604,0,0,0,0,0,1,0
1764901,1764901,-1,These sunglasses are totally CRAP! What pitiful human lives have been wasted to create such meniachal things!! Anyone who buys this is a supporter of satan and his army!! Heathens buy these! I hate heathens and I hate GLASSES,snnnnn,-0.9405376315116882,0,0,0,0,0,1,0
932563,932563,1,"Oh my goodness. It must be a crime to love an inanimate object so much. I have been suffering with a poor decision made years ago to purchase an under the cabinet Black & Decker can opener that loved to disperse the contents of the can on the counter. It finally started cutting so poorly that my depression era mentality allowed me to replace it. The West Bend arrived yesterday, right before I was ready to open three cans. It got the acid test with a 28-ounce can of enchilada sauce (okay, some of us have to have help). It didn't spill a drop. It's tall (allow 10 and a half inches) but doesn't take up that much length and width space (5 x 5 inches) on the counter. They also had me with the 70 watt motor and detachable head going in the dishwasher. Nosing around, Amazon had this in their Warehouse Deals section, where the box was supposed to be damaged (but it wasn't), and so the price was only $17.99 (new item with warranty) including super saver shipping (at $25 for total purchases).",spnnnuuuuuu,0.0,0,0,0,0,0,1,0
2411257,2411257,-1,"I noticed on reviewer here say that MuscleMedia is the magazine that has changed lives and the other magazines are steroid mags. MuscleMedia was the original steroid magazine. Although they did not publish photos of those steroid freaks, they did publish articles about how to buy and use steroids. Are memories so short and the propaganda so great that some should skip reality? This book could have been better. Bill Phillips is a smart guy, maybe his next book will be better.",suunnnp,0.8728542923927307,0,0,0,0,0,1,0
1450434,1450434,-1,"the steamer doesnt shut off automatically, so the base will get dry and the plastic covered heating element will melt. The bowl for steaming rice etc is so small it is a joke. Honestly i dont know why this product is on the market but i does tell to avoid Deni products.",snnn,-0.869081437587738,0,0,0,0,0,1,0
1675164,1675164,-1,"When the battery gets low, the alarm quits working and you have to know to change the battery. Perhaps a 200 pound person could stand on the clock without damaging it but, on my clock, the little circular handle for setting the alarm fell off. Now, in effect, the alarm doesn't work.",snnn,-0.7493357062339783,0,0,0,0,0,1,0
2948965,2948965,-1,"Japan has committed some of the world's worst atrocities in history (nanking massacre, unit 731, batton death march, comfort women, pearl harbor, ect..) and they still refuse to apologize, compensate, or make an accurate history in there textbooks. Why is Japan so cowardly and instead try to make their amends to their victims of the horrible crimes against humanity. No wonder people call Japan a ""devil"" race.",snnn,-0.8823608160018921,0,0,0,0,0,1,0
864396,864396,-1,"Action movies without soundtracks just don't work, IMHO. Just couldn't get into it. I think most everyone would pass on this one. I wish I had.",snnnu,0.0,0,0,0,0,0,1,0
1559918,1559918,-1,"I read the first ""section"" of the book and it was just okay. Maybe because I've been to Italy and knew the places she spoke of, etc. The second section bored me and I didn't even bother to finish the book. It constantly felt like Gilbert was bragging, blah blah blah I left my husband but it's okay b/c I have wealthy publishers to finance a trip around the world for me, and so on. I can't connect with that. Don't waste your time or money.",spunnnn,-0.6405968070030212,0,0,0,0,0,1,0
2551716,2551716,-1,"I saw Mission to Mars in the theater and this is simply the worst movie score I have heard in a long time.The purpose of music in movies is obviously to complement the on-screen content. This score, however, does nothing of the sort. It is trite, distracting, rambling, disjointed, and ugly. The use of several poorly-generated synthesized sounds in the orchestration highlight Mr. Morricone's lack of compositional ability.This score performs poorly in the theater because it has no musical value. It would perform even worse in a CD player.Do not buy this CD.",snnnnn,-0.9339424967765808,0,0,0,0,0,1,0
278281,278281,-1,This was the worst documentary I have ever seen. The only word I can think of is propaganda propaganda propaganda. They offered no real facts or hard evidence to support any of their harsh claims against Bill Clinton. I do not recommend this dvd.,snnnn,-0.9103573560714722,0,0,0,0,0,1,0
2327198,2327198,-1,"The Resort is one of the worst books I've ever read. It was just one gross-out scenario after another, with little to no character development and no redeeming qualities. (OK, I take back that last part. It had one redeeming quality in that it came with a 'satisfaction guaranteed' offer. I'm sending it in and getting my money back.)To be honest, I didn't even finish the book. Around 40 pages from the end I decided I was wasting my time, since it wasn't entertaining anymore. Before putting it down for good, I did skip to the last page to see how it ended, but all I got from that was the satisfaction of rolling my eyes at the author.If The Resort is a 'good' example of Bentley Little's writing, I will be avoiding his books in the future.",snnupunnn,-0.8102388978004456,0,0,0,0,0,1,0
3284983,3284983,-1,"Hertzberg has had a history of poking fun of people who have set lofty ideals of personal character and societal morality. Those who try to have these accepted as norms, inevitably have their ideals lampooned when it's shown that they're impossible to attain or sustain. Thus we have Limbaugh's drug addiction, Bennett's gambling habit, priestly buggery, etc.Hertzberg and his ilk never fail to use the weight of the fallen idealist to smash the moral underpinnigs of society. This is flawed logic. It will never work, not as long as there are good people and people to aspire to be good. What's the alternative? Hendrick Hertzberg has never thought about what the success of his goals would mean. Would the world be better off?",snnnnnuuu,0.0,0,0,0,0,0,1,0
932020,932020,1,"Irving's book is very detailed. However, his suggested death toll for the Dresden bombing (135,000) is inflated at least three times. Despite lacking heavy industry, Dresden was a regional capital, a communications center, etc., and therefore a legitimate target. As for the destruction of cultural treasures, the Germans merely got a taste of their own medicine. After the Warsaw Uprising, German crews with flamethrowers systematically burned Warsaw's archives and libraries, causing the loss of a half-million irreplaceable pieces of literature. The Germans also deliberately dynamited architectural buildings (among them the Royal Castle of Warsaw). The list goes on and on. So, although not done for this reason, this destruction of the loveliest of German cities was a fitting payback to the Germans.",spnunnnnn,-0.7204368710517883,0,0,0,0,0,1,0
