,Unnamed: 0,sentiment,review,emopattern,emoscore,pnp,npn,pnpn,npnp,ppp,nnn,Total_pnp_patterns
1709168,1709168,1,"The Ya Yas are the bestest of best friends. Everything about their lives is exponential, from the love to their tragedies. Its this passion for living that makes them so fascinating. The only disappointment is the lead character, the very boring daughter of Ya Ya Vivi, Siddalee Walker. Oh well, you'll get past her like I did and revel in all the glories of the Ya Yas.",spnpnp,0.7546819448471069,1,1,1,1,0,0,4
2360966,2360966,1,"A few uneven songs keep this from a 5 star rating but it remains one of my favorite albums by Bruce nonetheless. The desperate, consuming mood of ""One Step Up"" is one that most people who have suffered through a dying relationship can relate to. ""Brilliant Disguise"" & ""Tunnel of Love"" are some of the best lyrics he's ever penned. They both cut like a knife. But just when you think he's lost all sight of redemption he ends the album with the hopeful ""Valentine's Day"" where he reminds us all of what is really important in life. Don't overlook this wonderful collection of tunes from the Boss.",spnpnpp,0.9815285205841064,1,1,1,1,0,0,4
375659,375659,-1,"The cd title should be ""Horrible"". I am a big fan of Depeche Mode but this release is a big dissapointment. The songs ""Dream On"", ""I Feel Love"" and ""I Am You"" are the only tracks worth hearing in my opinion. I keep hearing all the talk of David Gahan's drug problem being a reason for bad work in the past. Well, with Exciter, I suggest you get back on the drugs if that's what it takes to produce good work!My amazement is that you can find many ""Exciter"" Bonus tracks on the internet that I haven't been able to find on the cd. And everyone of those Bonus Tracks is twice as good as what the group choose to put on their album. The guys definitely got the good and bad mixed up when deciding on which tracks to include with this release. Check out the bonus tracks on the net. If your a DM fan like me, you will probally be pleased with what you find. But don't bother with the Exciter release. Sorry Depeche Mode, hope you learned a lesson this time.",snnpnppnupnn,-0.7680075764656067,1,1,0,1,0,0,3
3315980,3315980,1,"I'm 6'5"" 270 pounds. So when I looked into stability balls I was really concerned with whether one would support me. So far, so good. I got it yesterday, blew it up in a few minutes, and sat on it (hesitantly at first) for over an hour. Then worked out for about an hour. It seems very durable and able to maintain my weight without a problem. The exercises on this thing are super effective, as I can feel today. The ball is just right as far as size goes.Someone complained about the pump, but I found it efficient. It's like a huge syringe. It worked fine. It only took me a few minutes to pump the ball up and that was with my one year old hanging on me so he could mess with the ball.If something happens and this product fails in some way, I will immediately update this review so that anyone who's concerned can know. So if you don't see an update, the TKO's going strong.",sunpuupppnpnu,0.0,1,1,1,0,1,0,3
1186257,1186257,-1,"Not great coffee. Rocamojo and PuraVida, which amazon also sells is so much better--and those aren't great just good. This is cheap coffee and tastes like it. I can't complain much at about $3 a pound but it's just ok, drinkable, but wouldn't buy again.",snpnp,0.4203457832336426,1,1,0,1,0,0,3
3006005,3006005,1,"I wouldn't recommend this dvd to a beginner yogi as the length of the practice and the poses can be challenging for someone who has never ventured into yoga before. However, for the intermediate-advanced yogis, I think this is an excellent dvd for those days where you feel a burst of energy. The only hang up I have with the dvd is that it's 60+ minutes and hard to customize for those days where you just don't feel like doing 60+ minutes of yoga. But it is certainly a great workout and I'm happy that I purchased it.",snpnp,0.9852898716926575,1,1,0,1,0,0,3
1609570,1609570,-1,"I refused to believe all the hype about this book for a couple of years until just recently I finally picked it up. Wow. I was disappointed. The story itself is provoking and brings up some interesting points, but overall it is a cheaply written thriller.There are much better, more interesting thrillers by Michael Crichton and the likes. Overall I would compare this book to a cheap action flick, one that causes you to laugh at the shear audacity of many of the scenes, laughing, pointing and saying ""Hey! That could never happen!""In conclusion, if you like books you probably won't like this one. If you prefer reality TV then you will love this book. Blah.",snpnpunnpu,0.0,1,1,0,1,0,0,3
602400,602400,-1,"My wife loved the ""Opera"" show about The Secrete so much that we both wanted to get the video. We were expecting more information about the author's personal story but instead the video is made up of shots of the speakers giving their speeches and it comes across as a low-budget documentary.The production is so poor that it's hard to watch it all the way through (cheesy, repetitive and sometimes boring). The content is very similar to original ""universe"" thinkers such as Napoleon Hill's ""Think and Grow Rich"".If you've never explored self improvement products maybe this could help, if you can sit through it. This is not worth the $29 in my opinion. Get it used at a discount if you really want to see it. This is just a money making/marketing gimmick with no real applicable answers to the curiosity generated by the Opera show(s). This is pure marketing with no real value.",spnpnunn,-0.8751766681671143,1,1,1,0,0,0,3
1855518,1855518,1,"tag team table matchdudleys vs batista and ric flairnot that good ric flair does not do much what else can you expect from a 50+year old man 6/10rey mysterio vs jamie noble cruiserweight titletoo short with nidia costing noble the match 5.5/10eddie guerrero vs chavo guerrerotoo dissapointing watch chavo classic get the crap beaten out of him at the end 7/10WWE title hardcore holly vs brock lesnarwhy do people hate this match? nice ending with brock retaining his title 9/10World heavyweight titleHHH vs hbk last man standinggood buildup,match and high spot when hbk misses with a moonsault and goes throgh the anouncers table. hbk hits hhh with sweet chin music and both are down for the 10 count terrible ending 7.5/10royal rumble match. with mick foley in the rumble and undertakers gong it made it a whole lot better. chris benoit wins best match 10/10buy this for the royal rumble and both world title matches 70/100",snpnpp,0.9496603012084961,1,1,0,1,0,0,3
909479,909479,-1,"I started it, but I couldn't finish it. These kinds of books are right up my alley, but I could only make it to about page 100. All the things mentioned by other reveiwers (poor sentence structure, cheesy dialogue, etc.) just made me regret the purchase. The cover, which is what caught my eye initially, was good. However, I fell prey to the old adage, you can't judge a book by its cover. Sorry.",snpnnpnu,0.0,0,2,0,0,0,0,2
1574481,1574481,1,"I picked up this book over 20 years ago and read it. It made so much sense! I was (and am still, but working on it!) codependent and I didn't follow their advice. Now my kids are adults, 28 and 33. I have just now re-read the book and this time I AM going to follow thru! If I had done so, 20+ years ago, I would not be going thru what I am now! This is an EXCELLENT book! I cannot overstate it's usefulness! If you want to stop ""hating"" your teen for all they are doing to you, agst you, and agst themselves, read this! YOU deserve self-care, you deserve respect, and yes, so do they. Your kids, no matter what their ages, ""have everything they need to make their own decisions and run their own lives."" ""Watch with interest"" as they change under your own eyes with the help of the advice in this book. Well worth the read!Also highly recommended in conjunction with this book, is reading ""The New Codependency"" by Melodie Beattie on self-care. Desperate parents need help! You can't do it alone.",suppnupnppnpuupnu,0.0,2,0,0,0,0,0,2
3360689,3360689,1,This is a great product. We use this at our Elementary school. I love the fact that it is done by grade level which I find really helpful. The six kids that I have been working with really like the game. It isn't that easy and can be very challenging for the kids. We have also Math munchers which is just as fun!,spuppnp,0.9693577885627747,1,0,0,0,0,0,1
2693523,2693523,-1,"It seems that anything good gets discontinued rather quickly. Kleenex 160 2-ply was the perfect box. And this item is so pricey, I cannot believe that Amazon.com is promoting it.",snpn,-0.8889200687408447,0,1,0,0,0,0,1
572217,572217,-1,"Everyone is entitled to their personal opinion; that's one of America's greatest attributes, however, we will have to fight in order to keep it. As for the book; I think it sucks. That's about as informative and entertaining as I can be on the review. Definitely ""New Age""; definitely misleading.",sunpn,-0.8269411325454712,0,1,0,0,0,0,1
514643,514643,1,"I was never a huge fan of Josh Gracin on American Idol but I am pleasantly surprised by the quality of this CD. I can certainly say that Josh found his niche in music. This is an outstanding CD. Song after song, he comes through with a great voice! There is only 1 song on the CD I don't care much for. This CD had the potential of at least 4 hit songs! I would certainly recommend this CD for country music fans.",sppppnpp,0.9690284729003906,1,0,0,0,1,0,1
1628531,1628531,1,"THIS IS THE BEST COOKBOOK I OWN AND I OWN ABOUT 50. I DONT HAVE A LOT OF TIME TO COOK , SO I LIKE THINGS SIMPLE TO PREPARE. THIS IS A GREAT COOKBOOK FOR EVERYONE.",spnp,0.985082745552063,1,0,0,0,0,0,1
2909268,2909268,1,"i never thought that i would review an album on amazon, but ""consumed"" has forced me to type this review. it is absolutely amazing, it is one of those products of creativity that shines so bright, everyone will know that it exists. you will not be the same after listening.",snpn,-0.7147659063339233,0,1,0,0,0,0,1
2769084,2769084,1,"Yes, it is a two-volume novel - probably 1200 pages plus. But you won't want to skip a word.Sironia, Texas is a favorite of mine. One reason is its pitch-perfect evocation of time, place, and people (Texas, early 1900s). It is a grand page-turning story based on the author's home-town of Waco, Texas - and many local citizens were not happy with the well-guarded secrets that were exposed when the book was published. It was a best seller in the early 1950s and is still a good read today.",suppnp,0.966133177280426,1,0,0,0,0,0,1
1613071,1613071,1,"This drive is beautiful on the outside, but a bit noisy while reading or writing at any speed. The TDK software is unusable, but the Nero Express bundled is very usable and saves the day. The software package that came with my old HP was much better in every aspect.Nevertheless, the drive itself works flawlessly and burns at top speed without errors reading from my 5400 rpm hard disk, even with files scatered all over the disk. It adjust to lower speeds automaticaly while burning to avoid buffer underruns and I've never lost a CDR with this drive.All in all a good purchase, but the TDK software that comes with it needs a serious makeover. It is sluggish, confusing and not user friendly at all.",spnppn,-0.9232997894287109,1,0,0,0,0,0,1
2281422,2281422,-1,All Roxio products I've used on several different operating systems have always had one problem or another. I found their support staff to be worthless and returned my last Roxio Product vowing to never buy anything they made again. I know others rave about Roxio but I think as with all products there is always a certain percentage of dedicated enthusiasts that will support the product regardless of problems. System lock-ups might be expected on slower cpu's with little memory but I've had some powerhouses freeze up with Roxio.,snnpn,-0.616456151008606,0,1,0,0,0,0,1
3236819,3236819,-1,"I owned this switch for a little over a year. It slowly died taking my LAN with it (slowly). It took me a long time to figure it out since my LAN is fairly complex and contains several switches. However, I had 3ea of the Linksys SR20xx 8-port models die on me much faster. Fortunately, those were much easier to find since they just died completely when they went. So, I am not going to purchase any more of the Linksys SR20xx products. I hope that others are more fortunate, but I have had too many of them fail and am now trying D-Link switches. I used to really like Linksys and their hardware used to work forever (or so it seemed).",sununpnnp,0.9430433511734009,0,1,0,0,0,0,1
752457,752457,1,"I want to qualify my ""4 star"" ranking, especially in light of everyone elses 5 star. I loved the book, I couldn't put it down especially during the last 100+ pages. It is the best of the King's Blades series, all of which I have enjoyed. I was sure I knew what the ending would be and missed it by a mile. The only reason I give it a 4 star is that I love Duncan's early stuff, the Reluctant Swordsman, Man of His Word, and those, even more than I enjoy the Blades series. Duncan writes very well, his worlds are believable, his characters are rich and grow and change. If you don't own everything he has written, you should. Buy used copies if you can't find new, but get them.",suppnppuu,0.0,1,0,0,0,0,0,1
968133,968133,1,I used Celestron scopes on a university level for 8 years for serious purposes and fell in love with them. The thing is I haven't been involved much the past 15 years in astronomy for various reasons. I decided to get back into it recently and purchased this scope. Man I had forgotten how amazing their optics really are!! I am impressed with the ease of set up and the light wieght of this scope and most of all with the fact that in less than perfect light conditions I could still pick out the Cassini division in Saturn's rings with a 25mm lens and a 2X barlow. I look forward to using it for astrophotography of deep sky objects very soon.I also had need to call support about software and they were very helpful and quick. Solved my problem very simply within just a few minutes and the time it took to download the application.,spnppppp,0.7134630084037781,1,0,0,0,1,0,1
2336536,2336536,1,"I bought this movie awhile back and it just sat around for a long time. I finally pulled it off the shelf and decided to watch it. It was a good movie and I enjoyed the man in the mosquito monster costume. While its no oscar winner, I wouldnt say it was the worst film i've ever witnessed. A very fun movie and not nearly as bad make it out too be.",suupnp,0.9575779438018799,1,0,0,0,0,0,1
817786,817786,1,"This book, ""Kentucky Bad Boy"" is a fantastic assembly of unique childhood stories that will please most readers from 8 to 80! After finishing this short book, you are left with a sad feeling...there must be more! More of these stories that will make the reader feel ""satisfied"" like the first ones. The author has a communication style that lets the mind wander to truly appreciate all the shenanigans that young boys can get into. Can't wait until the revised edition is published and Mr. Rains includes additional stories that even his wife, Suzie, may try to edit beyond recognition. All I will say is ...DON'T!",spnpppuu,0.0,1,0,0,0,1,0,1
2797329,2797329,-1,"Was hoping for a return to kick arse music, but after listening several times, I find im just bored. All the songs sound the same, and none really stick out. Disturbed's first two albums were by far better than this one. Seems like they were more interested in getting out a message album (about their dislike for bush, war, etc), and less about rocking. Go back to writing about girls, it makes for better songs.",snnpnu,0.0,0,1,0,0,0,0,1
458741,458741,-1,"Whatever excellent features this polarizer has were totally ruined by the fact that the lens cap would not fit onto the lens, once this polarizer is in place. I use Nikon lenses, and all of them have circular polarizers, and admittedly most are Nikon polarizers, and all will allow the lens cap to fit over them. After 28 years using polarizers on all my lenses I had yet to run across one which would not accept the lens cap. Which means that a person has to remove the polarizer to replace the lens cap.... not amusing out in the field, or anywhere for that matter. The attributes of the thing seem excellent - appearance, construction, optical quality, value - all good. But not accepting the lens cap is a deal breaker for me. If you only use a polarizer occasionally, I suppose you wouldn't be bothered by this, but I keep them attached to my lenses nearly 100% of the time.",snpunpnu,0.0,0,1,0,0,0,0,1
2414654,2414654,-1,"What a waste of millions of dollars and some of the world's finest actors. This tediously long film is a mixture of Upstairs-Downstairs and Agatha Christie. Altman just doesn't understand either the upstairs or downstairs people. His ""sexy"" scenes are embarrassingly dumb. Some of the dialogue is unintelligible, especially when it is delivered by people pretending to be from Scotland. And at the end, when three people ""rip off their masks,"" so to speak, and are really other people, the dialogue is so clumsy that if you look the other way for a second you'll miss the plot summation. This is a film that deserves to be listed in the Turkey book, under the title Most Expensive. It fails to be amusing, insightful, or even entertaining. The worst part is the script, and so, predictably, the writer received an Academy Award,",snnnnnnpnn,-0.9361222386360168,0,1,0,0,0,2,1
2859475,2859475,1,"I have to say this album is hot, Ron Isley still can sing! I rate this album as a classic with Eternal and Body Kiss. I can't wait for the next one, I'm a loyal fun and I hope to catch him on tour.I'm 20 yrs old and this album appeals to me and is better than alot of recent R & B releases. All the young guys should listen to this old mack and learn something! Go buy this album!",spppnp,0.8082312345504761,1,0,0,0,1,0,1
236224,236224,1,"i really enjoyed this one. i dont how i missed it so many years ago. it is a timeless story, well written.",spnp,0.9575970768928528,1,0,0,0,0,0,1
3381601,3381601,-1,"I've enjoyed the Alice 19th series until the end with this last manga installment. I thought it was completely unnecessary to add two extra characters, Mei Lin and Billy, just at the very end. I thought they filled too many pages of this manga with unnecessary filler. Those extra pages could have been used to wrap up Alice and Kyou's finale in much more depth! Frei, my favorite character of the series, lost his sparkle and appeal too. I was also pretty unsatisfied with Mayura's resolution, it was very discrete. I love Watase as an author, I've read most of her series: Fushigi Yugi, Ceres, Absolute Boyfriend. But I found this one's ending to be the most unsatisfactory of them all.",spnnuunpn,-0.9212211966514587,0,1,0,0,0,0,1
2392606,2392606,-1,"Having heard instructors rave over Leonard's writing style at two writers' conferences, I decided that I'd better read a book by this ""master of dialogue"" for my edification. By chance, this one was just being published. I immediately noticed his choppy writing style. By the time I had slogged through 15 pages my head ached. I was so distracted by the choppy sentences and sentence fragments that I couldn't follow the story. Maybe other readers will eat it up, but this kind of writing turned me off. Why he has such a great reputation I'll never know. Sorry, Elmore, you're not my cup of tea. Give me Dan Brown any time.",suunnnnpnu,0.0,0,1,0,0,0,1,1
60996,60996,1,"There is a dead body. Where is her car? Why is she swimming alone? It seems her body is expensively cared for. A young man appears on the scene, weeping. It seems that he had taken her car.The name of the drowned woman is Christine Clay. Inspector Alan Grant of Scotland Yard is called to the scene by a worried constabulary. The young man, Robin Stannaway or Robert Tisdall, the name had been changed to Tisdall to please a relative, stayed with Chris. She had picked him up when hitchhiking, saying that she was alone. The boy clearly has charm. Grant and others determine that it is probable murder.The book suffers from having the most likeable characters mainly off-stage or dead. In other respects, of course, it is wonderful, given that Josephine Tey was one of the best people writing in the genre.",snuuunuuuupnp,0.9786863923072815,1,0,0,0,0,0,1
2719236,2719236,1,I first saw this film at a sold out opening in San Francisco and totally enjoyed it along with an enthusiastic aduience. Though it does not have a big budget it is well made with great non-computer generated gore. Full of real old fashioned blood and guts!! Good humor and a good time.,sppnp,0.968255341053009,1,0,0,0,0,0,1
1660265,1660265,-1,"Besides all the disk write errors I received (and detailed in other reviews here), my DR1F9H gave up the ghost in more than 3 months, but less than 4. Interesting, the labor portion of the warranty only runs 3 months. so, I would have to pay labor cost to fix this piece of junk.Look at all the DR1F9H refurbs being sold on eBay. Avoid at all costs. Spend your hard earned money elsewhere.",snpnnn,-0.5235662460327148,0,1,0,0,0,1,1
1667881,1667881,1,"I just finished the last sentence of this excellent book, and just had to write about how good it is! This book has been on my shelf for some time. I am not sure why it took me so long to read it, but I am really glad that I finally did. The Veterinarians and animals that they care for were wonderful to read about. Even the sad bits (which are inevitable where animals are concerned) were not too bad to read about. McSparren's writing has a way of easing the pain. Honestly I cannot think of anything negative to say about this book. The human interest in this book also holds some interest for all ages. The reader gets involved with the lives of Maggie, her husband, children and friends. This book is unique and will be a tough act to follow. I savored every word, laughed and cried. I highly recommend it to anyone that loves all of God's creatures.",spuppupnpuppp,0.9829859137535095,1,0,0,0,1,0,1
270911,270911,-1,"It's amazing how music like this can be so credited and popular even though sp have a large fan base. While on the topic of there fan base, it is worthy to note that this music cannot appeal to ne one ecxcept ppl who are between 13 to 15 yer old. The lyrics are really plain and even an 8 year old could write such stuff which is inspired by small teenage problems such as bad relationships and controlling parents. To be homest i bleve that sp has a decent sound and could really have done much more with there music if they were able to dig deeper and write good inspired songs. I dont think they wud even know some of the more serious problems that most teenagers go thru. Having heard a good amount of this album on my 15 year old sisters cd player i cant say much that wud make sp seem like a good band in general let alone a good punk rock band.",spnnpnn,-0.5590435862541199,0,1,0,0,0,0,1
369992,369992,-1,"Not since Norah Jones has someone been so overrated, and as the previous commentator said it better than I, mind bogglingly pretentious. And at least Norah Jones was pleasant, in a kind of young sort of sesame street kiddie appeal, and Jones is cute and has a sort of harmonious prettiness. Stone however already seems to have a Joplin sort of mannish hideousness and middle aged spread going for her. To paraphrase Cracker: the world needs another overrated tired white girl pretending to be black and around the block a few times a la Aretha Franklin, like I need a whole in my head!Go away Joss Stone-at least just torture your own country men and women!",snpnn,-0.8739415407180786,0,1,0,0,0,0,1
2926431,2926431,-1,"Simple-minded plot consisting of mismatched over-the-top cliches incoherently scotch-taped together; what seems to be a systematic effort to include enough sexist, racist, and religious stereotypes to offend everyone on Earth and most of their house pets; incredibly cheap, jerky, worse-than-the-worst-of-Saturday-morning animation; and enough graphic violence to give the children who are supposedly the target audience nightmares. This is worse than the Super-8 ""movie"" my friends and I made in 9th grade, and I didn't think it could get worse than that. Just to make it even worse, there is just enough actually striking rotoscope imagery to give the viewer a hint of the potential that was blown in this project. If I were Ralph Bakshi or anyone else associated with this, I would change my name and pretend I'd never heard of it.",snnpn,-0.7863667607307434,0,1,0,0,0,0,1
3550183,3550183,1,"This is a very good wrist brace. The only issue is that the thin neoprene that goes around your thumb can start hurting your hand if you wear it for extended period of athletic activity. But it's very well made, no problems. Mine was not blue, as shown in the picture, it is black, which is good.",spnpp,0.8501058220863342,1,0,0,0,0,0,1
2471450,2471450,1,I love this book! I made two of the recipes...they were extraordinary...delicious and visually stunning. I put Martha Stewart to shame! My guests were amazed. I can't wait to try all of the recipes. The book is much better than I imagined. THe best new cookbook I have tried...in years! Thanks Deborah. When is the next book coming?,sppnpppppu,0.0,1,0,0,0,1,0,1
