,Unnamed: 0,sentiment,review,emopattern,emoscore,pnp,npn,pnpn,npnp,ppp,nnn,Total_pnp_patterns
2774611,2774611,-1,"Maybe I need to practice my grating skills, but whenever I grate anything some ends up in the attached cup, but some ends up on top of the grater and inevitably ends up all over the counter.The grater only allows you to grate horizontally. This feels more comfortable than vertical grating and allows you to grate more quickly.The plastic seems solid and the blades are sharp. The quality is good, but having food end up everywhere is annoying.",snpn,-0.8320492506027222,0,1,0,0,0,0,1
2186763,2186763,-1,"Any resemblance between this music and Cha cha cha is purely fictional. I have been a Cha cha cha dancer my entire life. and find this CD a sham. The artists had the gaul to present this music as cha cha cha. It is obvious that they do not know ballroom, at least, Cha cha cha. I should get my money back.",snpnunn,-0.4798588752746582,0,1,0,0,0,0,1
2482768,2482768,1,"This book was definetly one of the best books I've ever read, and I strongly recommend it. It was so true when Khalid said of Irene, but it applies to every American, she has an inborn, cultural arrogance that makes her blindto other ways of acting,perceiving, thinking about the world.This explains the bumper stickers, Proud to be an American and flags everywhere. Americans don't see the pain they are causing because they are all blind with arrogance. I learned, and laughed and cried from this book! It was hard to put down and I hated to finish reading it, I wanted it to go on but I would like to see Israel end it's occupation of Palestine!",spnnpn,-0.9211249947547913,0,1,0,0,0,0,1
2952613,2952613,-1,"I have Documents to Go installed on my Visor handheld. It works OK except for a major problem that you should be aware of. Maybe it is only me, but a number of times I have worked hours on a document and stored it. Then when I hotsych to my computer, the file is lost and does not show up on my PC either. I only get an indicator on my Visor saying that the file contents are not there. Imagine the frustration and wasted time. I am a proficient computer user. I write macros, manage a website, and am starting to learn PHP, but I haven't been able to resolve this problem. Perhaps there is a way around the problem but unless you are prepared to sink a lot of time figuring it out, be forewarned of this.",suuunnnpnn,-0.7257083058357239,0,1,0,0,0,1,1
3175547,3175547,-1,"This clip is absolute trash. It sounds be, very durable for construction work because it's RUBBERIZED. What a joke that is. Within the first day of work the belt clip part broke. It just fell apart. I guess u get what u pay for.",snpnnnu,0.0,0,1,0,0,0,1,1
2549551,2549551,1,"I admit I have a makeup obsession, eyeshadow and lipstick in every shade, eyelashes, all of it. I tried this little gem after seeing reviews on it. Love that I am using less of my foundation, saving me $$. It gives a air brushed look to my face. It can be a little tricky at first so definately watch the tutorial video on their web site, huge help. Also don't use it for the first time before work or if your in a time crunch, once you get rhythm down your fine. My only problem with it is it leaves little specks of foam on my face. Easily wiped of with the hand but annoying and the reason for the 4 stars. Still not annoying enough that I stop using it daily. Two tips: squeezing out less water makes it great for a sheer summer coverage. I use j&j baby wash to clean my makeup sponge and brushes. Works great, gentle and less $$$ than the brand cleanser.",spppnpunnnpup,0.937381386756897,1,0,0,0,1,1,1
1201488,1201488,1,"I love when I can one-click an item and it shows up quickly on my doorstep ! this is exactly what happened. Great book, in great condition.THANK YOU !!!!!!!!!!!!!",spnppp,0.689428985118866,1,0,0,0,1,0,1
2566385,2566385,1,"Well, all I wanted to say about this record is that it's really good. It's an emotional, powerful, energetic masterpiece. I'm sad at the fact that this band is no longer together. They sound great live, and on that note, if anyone was wondering, the unlisted tracks are live and I will list them for anyone that is interested.18. the poet you never were (live)19. ariadne's friend (live)20. notres langues nous trompent (live)21. the sweetness and the light (live)22. endymion (live)well, that is that.adios-brian",sppnpu,0.0,1,0,0,0,0,0,1
20646,20646,1,"I bought this CD because I read on this web page that this was the best selling CD and there was a lot of good reviews. I have never bought or really heard Moby before but I have read some interesting stuff about him. Right away I recognized a couple of songs. I noticed when browsing for some new techno that many people who bought the CDs I did, also bought this one. My friend told me ""its kinda slow at first so give it a listen to"". Personally I like the first few songs the best. They are worth the price of the CD. I think the end gets a little slow. Good sound on this recording - excellent production from beginning to end! Good music to get the ladys dancing. Good music to chill with your woman (like smoke some hoochy and get your groove on, ya know what I'm sayin?) then after y'all have been at it for a while, the end kinda mellows out as you smoke your last cigarette and go to sleep. I want to buy some more Moby!",sppuuuppnpppup,0.7592889070510864,1,0,0,0,1,0,1
1502105,1502105,-1,"It makes me laugh when Hollywood choses to include the Bible in their movies when ther clearly haven't read it. Jesus conquered death! End of story. Those who choose to follow Him in spirit and truth will leave this cursed world and spend eternity in Paradise. No more sadness, pain, destruction, etc. Choose Jesus, Choose life! I love Hugh Jackman but I couldn't sit though this movie.",snpupnpp,0.6458619236946106,1,0,0,0,0,0,1
616536,616536,-1,"Rent this movie. Don't pay the 9 or 10 dollars it's going to cost you to get in (unless you're old like me which would mean 'only' a 6 or 7 dollar admission). It'll keep you interested for about the first 45 minutes. After that I become distracted by the endless closeups (full-face, profile, eyes only, mouth only, top of head, hands) and pained expressions which substituted for meaningful dialogue. Frankly, my mind began to wander..wondering why Redford didn't stay out of the sun in his youth, why Dafoe's skin is beginning to look like linoleum, why there was only that one shot of the dog, why Helen Mirren would sign on for such tripe. I'm giving it 2 stars for the actor playing the detective. He was good. His assistant had one line. I'm always curious about such shenanigans.",sunpnnppuu,0.0,0,1,0,0,0,0,1
